{"verifrax_version":"2.6.0","certificate_version":"1.0.0","bundle_hash":"6f95d18247f958c7253d542229a427db008152f02856bd52f3023cb610ecdf21","profile_id":"public@1.0.0","verdict":"verified","reason_codes":[],"executed_at":"2026-01-01T21:45:27.961Z","certificate_hash":"164817f38d99ecbf6439972152509235549b3a967e442e666946689577f77d15"}