{
  "bundle_hash": "6844deb82bb6806be4b70db7e97ef8c0e6a52d689e2dc51ee77fe810c34e21a8",
  "certificate_hash": "d7c23b65887c0ef554555b231c59935f6e2717586b54a68da8dc49b0bc61731b",
  "certificate_version": "1.1.0",
  "executed_at": "2026-01-24T12:21:29.434Z",
  "profile_id": "public@1.0.0",
  "reason_codes": [],
  "verdict": "verified",
  "verifrax_version": "2.8.0"
}
